{
  "$schema": "http://json-schema.org/draft-07/schema#",
  "$id": "https://household-account.local/schemas/payment-capture/payment-occurrence-year.v1.schema.json",
  "title": "Payment Occurrence Year Contract Fixture V1",
  "description": "연도가 생략된 결제 시각을 Asia/Seoul 기준의 가장 가까운 미래가 아닌 연도로 해석하는 공개 정책의 비식별 계약 fixture입니다.",
  "type": "object",
  "additionalProperties": false,
  "required": [
    "schemaVersion",
    "policy",
    "cases",
    "equivalenceGroups"
  ],
  "properties": {
    "schemaVersion": {
      "const": 1
    },
    "policy": {
      "const": "payment-occurrence-year"
    },
    "cases": {
      "type": "array",
      "minItems": 1,
      "uniqueItems": true,
      "items": {
        "$ref": "#/$defs/testCase"
      }
    },
    "equivalenceGroups": {
      "type": "array",
      "minItems": 1,
      "uniqueItems": true,
      "items": {
        "$ref": "#/$defs/equivalenceGroup"
      }
    }
  },
  "$defs": {
    "testCase": {
      "type": "object",
      "additionalProperties": false,
      "required": [
        "caseId",
        "requirementIds",
        "description",
        "input",
        "expected"
      ],
      "properties": {
        "caseId": {
          "type": "string",
          "pattern": "^[a-z][a-z0-9]*(?:-[a-z0-9]+)*$"
        },
        "requirementIds": {
          "type": "array",
          "minItems": 1,
          "uniqueItems": true,
          "items": {
            "enum": [
              "T-PARSE-003",
              "T-PARSE-TIME-001"
            ]
          }
        },
        "description": {
          "type": "string",
          "minLength": 1
        },
        "input": {
          "$ref": "#/$defs/input"
        },
        "expected": {
          "$ref": "#/$defs/result"
        }
      }
    },
    "input": {
      "type": "object",
      "additionalProperties": false,
      "required": [
        "month",
        "day",
        "hour",
        "minute",
        "receivedAt",
        "zoneId"
      ],
      "properties": {
        "month": {
          "type": "integer"
        },
        "day": {
          "type": "integer"
        },
        "hour": {
          "type": "integer"
        },
        "minute": {
          "type": "integer"
        },
        "receivedAt": {
          "type": "string",
          "pattern": "^\\d{4}-\\d{2}-\\d{2}T\\d{2}:\\d{2}:\\d{2}(?:Z|[+-]\\d{2}:\\d{2})$"
        },
        "zoneId": {
          "const": "Asia/Seoul"
        }
      }
    },
    "result": {
      "oneOf": [
        {
          "$ref": "#/$defs/successResult"
        },
        {
          "$ref": "#/$defs/parseFailureResult"
        }
      ]
    },
    "successResult": {
      "type": "object",
      "additionalProperties": false,
      "required": [
        "kind",
        "occurredLocalDateTime"
      ],
      "properties": {
        "kind": {
          "const": "success"
        },
        "occurredLocalDateTime": {
          "type": "string",
          "pattern": "^\\d{4}-\\d{2}-\\d{2}T\\d{2}:\\d{2}$"
        }
      }
    },
    "parseFailureResult": {
      "type": "object",
      "additionalProperties": false,
      "required": [
        "kind",
        "code"
      ],
      "properties": {
        "kind": {
          "const": "parseFailure"
        },
        "code": {
          "enum": [
            "INVALID_DATE",
            "INVALID_TIME"
          ]
        }
      }
    },
    "equivalenceGroup": {
      "type": "object",
      "additionalProperties": false,
      "required": [
        "groupId",
        "requirementIds",
        "description",
        "caseIds"
      ],
      "properties": {
        "groupId": {
          "type": "string",
          "pattern": "^[a-z][a-z0-9]*(?:-[a-z0-9]+)*$"
        },
        "requirementIds": {
          "type": "array",
          "minItems": 1,
          "uniqueItems": true,
          "items": {
            "const": "T-PARSE-TIME-001"
          }
        },
        "description": {
          "type": "string",
          "minLength": 1
        },
        "caseIds": {
          "type": "array",
          "minItems": 2,
          "uniqueItems": true,
          "items": {
            "type": "string",
            "pattern": "^[a-z][a-z0-9]*(?:-[a-z0-9]+)*$"
          }
        }
      }
    }
  }
}
